{
    "strict_acls": "on",
    "specific_queries": [
        "ls",
        "lsl",
        "ShowCollAcls",
        "listQueryByAliasLike",
        "findQueryByAlias",
        "ilsLACollections",
        "ilsLADataObjects",
        "listSharedCollectionsOwnedByUser",
        "listSharedCollectionsSharedWithUser",
        "listUserACLForDataObjViaGroup",
        "listUserACLForCollectionViaGroup",
        "DataObjInCollReCur"
    ],
    "hash_scheme": "sha256",
    "match_hash_policy": "compatible"
}
